{
  "date": "2026-05-27",
  "generated_at": "2026-05-27T07:30:00+08:00",
  "source": {"name": "x_social", "collector_version": "1.0.0"},
  "scoring_summary": {"total_tweets": 2, "scored_tweets": 2},
  "tweets": [
    {
      "id": "1234567890",
      "author": "openai",
      "text": "GPT-5 launches today with new reasoning capabilities.",
      "created_at": "2026-05-27T06:00:00+08:00",
      "score": 0.85,
      "dimensions": {"recency": 1.0, "safety": 1.0}
    },
    {
      "id": "9876543210",
      "author": "anthropic",
      "text": "Claude 4 now supports tool use in real-time streams.",
      "created_at": "2026-05-27T05:00:00+08:00",
      "score": 0.78,
      "dimensions": {"recency": 0.9, "safety": 1.0}
    }
  ],
  "focus_discussions": [
    {
      "topic": "AI model releases",
      "supporting_tweet_ids": ["1234567890", "9876543210"],
      "summary": "Major AI labs GPT-5 and Claude 4 both released new models with enhanced capabilities."
    }
  ]
}
